titulo,link
"Sem provas, Bolsonaro repete a embaixadores suspeitas já desmentidas sobre urnas",https://g1.globo.com/politica/noticia/2022/07/18/bolsonaro-reune-embaixadores-para-repetir-sem-provas-suspeitas-ja-esclarecidas-sobre-urnas.ghtml
Pacheco contesta Bolsonaro e reafirma confiança nas urnas,https://g1.globo.com/politica/eleicoes/2022/noticia/2022/07/18/pacheco-contesta-bolsonaro-e-reafirma-confianca-nas-urnas-saiba-o-que-politicos-disseram.ghtml
Fachin reafirma segurança do sistema eleitoral brasileiro ,https://g1.globo.com/pr/parana/eleicoes/2022/noticia/2022/07/18/fachin-reafirma-seguranca-do-sistema-eleitoral-brasileiro-em-evento-no-parana.ghtml
Média móvel de mortes por Covid é de 248 e indica estabilidade ,https://g1.globo.com/saude/coronavirus/noticia/2022/07/18/brasil-registra-143-mortes-por-covid-media-movel-de-casos-completa-25-dias-acima-de-50-mil.ghtml
"Líderes de 11 estados do MDB estarão com Lula, diz Eduardo Braga",https://g1.globo.com/sp/sao-paulo/eleicoes/2022/noticia/2022/07/18/lula-se-reune-em-sp-com-caciques-do-mdb-em-busca-de-apoio-do-partido.ghtml
Moraes manda bolsonaristas apagarem fake news sobre Lula,https://g1.globo.com/politica/eleicoes/2022/noticia/2022/07/18/moraes-manda-tirar-do-ar-postagens-de-apoiadores-de-bolsonaro-com-fake-news-sobre-lula.ghtml
Avião da Gol arremete para evitar batida com aeronave da Latam,https://g1.globo.com/sp/sao-paulo/noticia/2022/07/18/aviao-da-gol-arremete-apos-se-aproximar-do-aeroporto-de-congonhas-com-aeronave-da-latam-na-pista.ghtml
